{
  "entry_id": "entry-001",
  "subject_id": "did:example:registrar-123",
  "role": "registrar",
  "scope": [
    "IN:GST",
    "trade-documents"
  ],
  "status": "active",
  "issued_at": "2026-03-03T00:00:00Z",
  "evidence": [
    {
      "type": "policy_binding",
      "ref": "policies/admission-policy-v1.pdf",
      "sha256": "0000000000000000000000000000000000000000000000000000000000000000"
    }
  ],
  "governance": {
    "policy_ref": "policies/admission-policy-v1",
    "decision_ref": "decisions/2026-01-15-approve-registrar-123",
    "approver": "did:example:authority-1"
  },
  "metadata": {
    "name": "Example Registrar 123",
    "website": "https://example.org"
  }
}